type,clientName,clientNameEn,code,description,exchange,full_name,name,securityName,stockNo,createdAt,updatedAt,marketCapPrev,sharesOutstanding,sort,symbol_ref,lastDateSyncIDS
s,Công ty Cổ phần Vận tải và Dịch vụ Petrolimex Nghệ Tĩnh,Petrolimex Nghe Tinh Transportation and Service Joint Stock Company,PTX,,UPCOM,PTX,PTX,,upcom:77560,2022-05-05T06:56:56.259Z,2023-10-04T01:30:25.243Z,7718943600.0,6432453.0,,,
s,Công ty Cổ phần Lilama 3,Lilama 3 Joint Stock Company,LM3,,UPCOM,LM3,LM3,,upcom:7845,2022-05-05T06:56:56.328Z,2023-10-04T01:30:25.685Z,14935000000.0,5150000.0,,,
s,Công ty Cổ phần Bao bì Tiền Giang,Tien Giang Packaging Joint Stock Company,BTG,,UPCOM,BTG,BTG,,upcom:54805,2022-05-05T06:56:56.271Z,2023-10-04T01:30:25.705Z,11305000000.0,1190000.0,,,
s,Công ty Cổ phần Xe khách Sài Gòn,Saigon Passenger Transport Joint Stock Company,BSG,,UPCOM,BSG,BSG,,upcom:75299,2022-05-05T06:56:56.249Z,2023-10-04T01:30:26.066Z,791700000000.0,60000000.0,,,
s,Công ty Cổ phần Thủy điện Sử Pán 2,Su Pan 2 Hydropower Joint Stock Company,SP2,,UPCOM,SP2,SP2,,upcom:75020,2022-05-05T06:56:56.315Z,2023-10-04T01:30:26.544Z,251600600000.0,20623000.0,,,
s,Tổng Công ty Xây dựng số 1 - CTCP,Construction Corporation No.1 Joint Stock Company,CC1,,UPCOM,CC1,CC1,,upcom:76285,2022-05-05T06:56:56.323Z,2023-10-04T01:30:26.645Z,5279073068691.0,358170369.0,,,
s,Công ty Cổ phần Nước và Môi trường Việt Nam,"Vietnam Water, Sanitation and Environment Joint Stock Company",VWS,,UPCOM,VWS,VWS,,upcom:75509,2022-05-05T06:56:56.323Z,2023-10-04T01:30:26.664Z,60840000000.0,3600000.0,,,
s,Công ty cổ phần Group Bắc Việt,Bac Viet Group Joint Stock Company,BVG,,UPCOM,BVG,BVG,,upcom:12532,2022-05-05T06:56:56.331Z,2023-10-04T01:30:26.726Z,24455377584.0,9750948.0,,,
s,Công ty Cổ phần Viễn thông Telvina Việt Nam,Telvina Vietnam Communication Joint Stock Company,PMT,,UPCOM,PMT,PMT,,upcom:61452,2022-05-05T06:56:56.248Z,2023-10-04T01:30:26.787Z,37544000000.0,4940000.0,,,
s,Tập đoàn Dệt May Việt Nam,Vietnam National Textile And Garment Group,VGT,,UPCOM,VGT,VGT,,upcom:75485,2022-05-05T06:56:56.255Z,2023-10-04T01:30:26.841Z,6288000000000.0,500000000.0,,,
s,Công ty Cổ phần Thiết bị,Machinery Joint Stock Company,MA1,,UPCOM,MA1,MA1,,upcom:79423,2022-05-05T06:56:56.260Z,2023-10-04T01:30:26.914Z,79345725000.0,5289715.0,,,
s,Công ty Cổ phần Du lịch và Xuất nhập khẩu Lạng Sơn,Lang Son Tourism and Import - Export Joint Stock Company,DXL,,UPCOM,DXL,DXL,,upcom:55025,2022-05-05T06:56:56.261Z,2023-10-04T01:30:26.933Z,38391630000.0,3957900.0,,,
s,Công ty Cổ phần Dịch vụ Một Thế giới,One World Services Joint Stock Company,ONW,,UPCOM,ONW,ONW,,upcom:75682,2022-05-05T06:56:56.309Z,2023-10-04T01:30:27.848Z,7600000000.0,2000000.0,,,
s,Công ty Cổ phần Dịch vụ Môi trường Đô thị Từ Liêm,Tu Liem Urban Environment Service Joint Stock Company,MTL,,UPCOM,MTL,MTL,,upcom:74540,2022-05-05T06:56:56.319Z,2023-10-04T01:30:27.917Z,26676000000.0,6000000.0,,,
s,Công ty Cổ phần Đầu tư và Thương mại Dầu khí Nghệ An,PetroVietnam - Nghe An Investment & Trading Joint Stock Company,PXA,,UPCOM,PXA,PXA,,upcom:15356,2022-05-05T06:56:56.323Z,2023-10-04T01:30:27.953Z,19500000000.0,15000000.0,,,
s,Công ty Cổ phần Đường sắt Hà Lạng,Ha Lang Railways Joint Stock Company,HLR,,UPCOM,HLR,HLR,,upcom:75302,2022-05-05T06:56:56.251Z,2023-10-04T01:30:28.778Z,17325000000.0,1650000.0,,,
s,Công ty Cổ phần Xuất Nhập khẩu Nông sản Thực phẩm An Giang,An Giang Agriculture and Foods Import - Export Joint Stock Company,AFX,,UPCOM,AFX,AFX,,upcom:75301,2022-05-05T06:56:56.274Z,2023-10-04T01:30:28.965Z,358540000000.0,35000000.0,,,
s,Công ty Cổ phần Hồng Hà Việt Nam,Hong Ha Vietnam Joint Stock Company,PHH,,UPCOM,PHH,PHH,,upcom:8564,2022-05-05T06:56:56.333Z,2023-10-04T01:30:29.460Z,79640000000.0,18100000.0,,,
s,Công ty Cổ phần Bia Hà Nội - Thái Bình,Ha Noi - Thai Binh Beer Joint Stock Company,BTB,,UPCOM,BTB,BTB,,upcom:75519,2022-05-05T06:56:56.260Z,2023-10-04T01:30:29.595Z,49223846400.0,7691226.0,,,
b,,,BID122004,,HNX,BID122004,BID122004,,hnx:80982,2022-05-20T01:15:00.538Z,2022-05-20T01:15:00.538Z,,,,,
s,Công ty Cổ phần Dịch vụ Kỹ thuật Viễn thông,Telecommunication Technical Service Joint Stock Company,TST,,UPCOM,TST,TST,,upcom:3244,2022-08-08T01:15:00.597Z,2023-10-04T01:30:30.903Z,17760000000.0,4800000.0,,,
s,Công ty Cổ phần Giao nhận Vận tải Miền Trung,Vina Trans Da Nang Joint Stock Company,VMT,,UPCOM,VMT,VMT,,upcom:81525,2023-01-06T00:50:00.315Z,2023-10-04T01:30:31.306Z,108675000000.0,3150000.0,,,
w,,,CTPB2303,,HOSE,CTPB2303,CTPB2303,Chung quyen.TPB.KIS.M.CA.,hose:4710,2023-06-14T00:50:00.236Z,2023-06-14T00:50:00.236Z,,,,,
w,,,CMBB2305,,HOSE,CMBB2305,CMBB2305,Chung quyen.MBB.KIS.M.CA.,hose:4703,2023-06-14T00:50:00.237Z,2023-06-14T00:50:00.237Z,,,,,
w,,,CHPG2311,,HOSE,CHPG2311,CHPG2311,CQ.HPG.KIS.M.CA.T.29,hose:4722,2023-06-16T00:50:00.309Z,2023-06-16T00:50:00.309Z,,,,,
s,Công ty Cổ phần Sông Đà 4,Song Da 4 Joint Stock Company,SD4,,UPCOM,SD4,SD4,,upcom:4304,2023-06-28T00:50:00.283Z,2023-10-04T01:30:31.928Z,33990000000.0,10300000.0,,,
s,Công ty Cổ phần Lưới thép Bình Tây,Binh Tay Steel Netting Joint Stock Company,VDT,,UPCOM,VDT,VDT,,upcom:62692,2022-05-05T06:56:56.274Z,2023-10-04T01:30:23.416Z,62894080000.0,1965440.0,,,
s,Công ty Cổ phần Bột mỳ Vinafood 1,Vinafood 1 Flour Joint Stock Company,BMV,,UPCOM,BMV,BMV,,upcom:76100,2022-05-05T06:56:56.327Z,2023-10-04T01:30:23.096Z,1084160000000.0,24200000.0,,,
s,Công ty Cổ phần Môi trường Đô thị Tỉnh Lào Cai,Lao Cai Urban Environment Joint Stock Company,MLC,,UPCOM,MLC,MLC,,upcom:76024,2022-05-05T06:56:56.318Z,2023-10-04T01:30:23.048Z,53391040000.0,4171175.0,,,
s,Công ty Cổ phần Hàng hải Đông Đô,Dong Do Marine Joint Stock Company,DDM,,UPCOM,DDM,DDM,,upcom:73059,2022-05-05T06:56:56.261Z,2023-10-04T01:30:23.317Z,15917839600.0,12244492.0,,,
s,Công ty Cổ phần Đầu tư Phát triển Sóc Sơn,Soc Son Development Investment Joint Stock Company,DPS,,UPCOM,DPS,DPS,,upcom:73359,2022-05-05T06:56:56.310Z,2023-10-04T01:30:24.255Z,15542628500.0,31085257.0,,,
s,Công ty Cổ phần Cấp thoát nước Khánh Hòa,Khanh Hoa Water Supply And Sewerage Joint Stock Company,KHW,,UPCOM,KHW,KHW,,upcom:75684,2022-05-05T06:56:56.314Z,2023-10-04T01:30:23.620Z,652079908800.0,28599996.0,,,
s,Tổng công ty Đầu tư Nước và Môi trường Việt Nam - Công ty Cổ phần,Vietnam Water and Environment Investment Corporation - JSC,VIW,,UPCOM,VIW,VIW,,upcom:76829,2022-05-05T06:56:56.331Z,2023-10-04T01:30:24.596Z,580186000000.0,58018600.0,,,
s,Công ty Cổ phần Thực phẩm Hà Nội,Hanoi Foodstuff Joint Stock Company,HAF,,UPCOM,HAF,HAF,,upcom:76320,2022-05-05T06:56:56.331Z,2023-10-04T01:30:24.628Z,478500000000.0,14500000.0,,,
s,Công ty Cổ phần 22,22 Joint Stock Company,C22,,UPCOM,C22,C22,,upcom:77259,2022-05-05T06:56:56.332Z,2023-10-04T01:30:24.671Z,39050000000.0,3550000.0,,,
s,Công ty Cổ phần Vận tải và Thuê tàu,Transport and Chartering Corporation,VFR,,UPCOM,VFR,VFR,,upcom:1741,2022-05-05T06:56:56.334Z,2023-10-04T01:30:24.715Z,148935000000.0,15000000.0,,,
s,Công ty Cổ phần K.I.P Việt Nam,Vietnam K.I.P Joint Stock Company,KIP,,UPCOM,KIP,KIP,,upcom:74480,2022-05-05T06:56:56.313Z,2023-10-04T01:30:25.315Z,93100000000.0,9800000.0,,,
s,Công ty Cổ phần VIWACO,VIWACO Joint Stock Company,VAV,,UPCOM,VAV,VAV,,upcom:76324,2022-05-05T06:56:56.325Z,2023-10-04T01:30:26.006Z,876800000000.0,32000000.0,,,
s,Công ty Cổ phần Vận tải và Dịch vụ Hàng Hải,Tracimexco - Supply Chains and Agency Services Joint Stock Company,TRS,,UPCOM,TRS,TRS,,upcom:73721,2022-05-05T06:56:56.334Z,2023-10-04T01:30:26.052Z,174192640000.0,5443520.0,,,
s,Công ty Cổ phần May Xuất Khẩu Phan Thiết,Phan Thiet Garment Import Export Joint Stock Company,PTG,,UPCOM,PTG,PTG,,upcom:54326,2022-05-05T06:56:56.316Z,2023-10-04T01:30:26.564Z,1498855500.0,4996185.0,,,
s,Công ty Cổ phần DAP - Vinachem,DAP - Vinachem Joint Stock Company,DDV,,UPCOM,DDV,DDV,,upcom:73441,2022-05-05T06:56:56.279Z,2023-10-04T01:30:27.130Z,1597127316900.0,146109900.0,,,
s,Công ty Cổ phần Lilama 45.4,LILAMA 45.4 Joint Stock Company,L44,,UPCOM,L44,L44,,upcom:8104,2022-05-05T06:56:56.310Z,2023-10-04T01:30:27.212Z,2786000000.0,3980000.0,,,
s,Tổng công ty May 10 - Công ty Cổ phần,Garment 10 Corporation - Joint Stock Company,M10,,UPCOM,M10,M10,,upcom:76864,2022-05-05T06:56:56.327Z,2023-10-04T01:30:27.432Z,549288078800.0,31750756.0,,,
s,Công ty Cổ phần Sông Đà Cao Cường,Song Da Cao Cuong Joint Stock Company,SCL,,UPCOM,SCL,SCL,,upcom:12632,2022-05-05T06:56:56.275Z,2023-10-04T01:30:27.670Z,306596588672.0,17278888.0,,,
s,Công ty Cổ phần Kỹ thuật Xây dựng Phú Nhuận,Phu Nhuan Technical Construction Joint Stock Company,PNT,,UPCOM,PNT,PNT,,upcom:75539,2022-05-05T06:56:56.310Z,2023-10-04T01:30:27.876Z,67760585600.0,9282272.0,,,
s,Công ty Cổ phần Nông nghiệp và Thực phẩm Hà Nội - Kinh Bắc,Ha Noi - Kinh bac Agriculture and Food Joint Stock Company,HKB,,UPCOM,HKB,HKB,,upcom:73279,2022-05-05T06:56:56.330Z,2023-10-04T01:30:28.677Z,41279999200.0,51599999.0,,,
s,Công ty Cổ phần Bông Việt Nam,Vietnam Cotton Joint Stock Company,BVN,,UPCOM,BVN,BVN,,upcom:62572,2022-05-05T06:56:56.262Z,2023-10-04T01:30:28.846Z,72500000000.0,5000000.0,,,
s,Công ty Cổ phần Sản xuất Xuất nhập khẩu NHP,NHP Production Import - Export Joint Stock Company,NHP,,UPCOM,NHP,NHP,,upcom:73201,2022-05-05T06:56:56.311Z,2023-10-04T01:30:29.146Z,13788245000.0,27576490.0,,,
s,Công ty Cổ phần Công trình Đô thị Bảo Lộc,Bao Loc Urban Project Joint Stock Company,DTB,,UPCOM,DTB,DTB,,upcom:78619,2022-05-05T06:56:56.311Z,2023-10-04T01:30:29.166Z,22906245600.0,1558248.0,,,
s,Công ty Cổ phần Lilama 45.1,Lilama 45.1 Joint Stock Company,L45,,UPCOM,L45,L45,,upcom:75161,2022-05-05T06:56:56.281Z,2023-10-04T01:30:29.779Z,22027200000.0,4800000.0,,,
s,Công ty Cổ phần Đường sắt Hà Hải,Ha Hai Railway Joint Stock Company,HHR,,UPCOM,HHR,HHR,,upcom:75664,2022-05-05T06:56:56.307Z,2023-10-04T01:30:29.796Z,690000000.0,1380000.0,,,
s,Công ty Cổ phần Trang trí nội thất Dầu khí,Petroleum Interior Decoration Joint Stock Company,PID,,UPCOM,PID,PID,,upcom:19756,2022-05-05T06:56:56.312Z,2023-10-04T01:30:29.830Z,7600000000.0,4000000.0,,,
s,Công ty Cổ phần Bia Sài Gòn - Quảng Ngãi,Sai Gon - Quang Ngai Beer Joint Stock Company,BSQ,,UPCOM,BSQ,BSQ,,upcom:75699,2022-05-05T06:56:56.318Z,2023-10-04T01:30:30.095Z,1016190000000.0,45000000.0,,,
s,Công ty cổ phần Tập đoàn Giáo dục Trí Việt,Tri Viet Education Group Joint Stock Company,CAR,,UPCOM,CAR,CAR,,upcom:81161,2022-07-13T01:15:00.341Z,2023-10-04T01:30:30.634Z,101443200000.0,3200000.0,,,
b,,,CVT122008,,HNX,CVT122008,CVT122008,,hnx:81302,2022-08-18T09:38:15.434Z,2022-08-18T09:38:15.434Z,,,,,
b,,,CVT122007,,HNX,CVT122007,CVT122007,,hnx:81301,2022-08-18T09:38:15.434Z,2022-08-18T09:38:15.434Z,,,,,
s,Công ty Cổ phần Sản xuất và Thương mại Tùng Khánh,Tung Khanh Trading and Manufacturing Joint Stock Company,TKG,,HNX,TKG,TKG,,hnx:79981,2022-08-29T00:48:00.134Z,2023-10-04T01:30:31.027Z,37891872000.0,6315312.0,,,
e,Quỹ ETF DCVFMVNMIDCAP,ETF DCVFMVNMIDCAP,FUEDCMID,,HOSE,FUEDCMID,FUEDCMID,QUY ETF DCVFMVNMIDCAP,hose:4618,2022-09-28T23:01:00.217Z,2023-10-04T01:30:31.092Z,105210000000.0,10500000.0,,,
w,,,CMBB2215,,HOSE,CMBB2215,CMBB2215,CHUNG QUYEN MBB-HSC-MET12,hose:4647,2023-01-05T00:50:00.246Z,2023-01-05T00:50:00.246Z,,,,,
s,Công ty Cổ phần Cơ khí 120,120 Mechanical Joint Stock Company,CK8,,UPCOM,CK8,CK8,,upcom:81524,2023-01-06T00:50:00.315Z,2023-10-04T01:30:31.288Z,10800000000.0,3000000.0,,,
w,,,CSTB2303,,HOSE,CSTB2303,CSTB2303,CHUNG QUYEN STB/ACBS/CALL,hose:4686,2023-03-13T00:50:00.237Z,2023-03-13T00:50:00.237Z,,,,,
b,,,MSN123009,,HNX,MSN123009,MSN123009,,hnx:81662,2023-06-03T01:45:17.132Z,2023-06-03T01:45:17.132Z,,,,,
w,,,CTCB2302,,HOSE,CTCB2302,CTCB2302,CHUNG QUYEN TCB/ACBS/CALL,hose:4717,2023-06-15T00:50:00.330Z,2023-06-15T00:50:00.330Z,,,,,
w,,,CMWG2305,,HOSE,CMWG2305,CMWG2305,CHUNG QUYEN MWG/ACBS/CALL,hose:4715,2023-06-15T00:50:00.330Z,2023-06-15T00:50:00.330Z,,,,,
w,,,CSTB2310,,HOSE,CSTB2310,CSTB2310,CQ.STB.KIS.M.CA.T.29,hose:4729,2023-06-16T00:50:00.309Z,2023-06-16T00:50:00.309Z,,,,,
s,Công ty Cổ phần Cấp nước Hải Phòng,Hai Phong Water Joint Stock Company,HPW,,UPCOM,HPW,HPW,,upcom:75319,2022-05-05T06:56:56.334Z,2023-10-04T01:30:23.220Z,1172469652000.0,74206940.0,,,
s,Công ty Cổ phần Khoáng sản Viglacera,Viglacera Mineral Joint Stock Company,VIM,,UPCOM,VIM,VIM,,upcom:75586,2022-05-05T06:56:56.329Z,2023-10-04T01:30:23.191Z,31875000000.0,1250000.0,,,
s,Công ty Cổ phần Xây lắp Thương mại 2,Architects & Construction Service Corporation,ACS,,UPCOM,ACS,ACS,,upcom:76281,2022-05-05T06:56:56.263Z,2023-10-04T01:30:23.335Z,29200000000.0,4000000.0,,,
s,Công ty Cổ phần Xuân Hòa Việt Nam,XuanHoa Viet Nam Joint Stock Company,XHC,,UPCOM,XHC,XHC,,upcom:75220,2022-05-05T06:56:56.315Z,2023-10-04T01:30:23.680Z,666333400000.0,21086500.0,,,
s,Công ty Cổ phần Công trình đô thị Nam Định,Nam Dinh Urband Construction Management Joint Stock Company,UMC,,UPCOM,UMC,UMC,,upcom:76459,2022-05-05T06:56:56.319Z,2023-10-04T01:30:23.744Z,18416170000.0,1841617.0,,,
s,Công ty Cổ phần Lương thực Thành phố Hồ Chí Minh,Ho Chi Minh City Food Joint Stock Company,FCS,,UPCOM,FCS,FCS,,upcom:75667,2022-05-05T06:56:56.320Z,2023-10-04T01:30:23.764Z,243816550000.0,29450000.0,,,
s,Công ty Cổ phần Vật liệu Xây dựng Bưu điện,Post and Telecommunications Construction Material Joint Stock Company,PCM,,UPCOM,PCM,PCM,,upcom:76381,2022-05-05T06:56:56.325Z,2023-10-04T01:30:23.852Z,64680000000.0,3920000.0,,,
s,Công ty Cổ phần Đầu tư và Xây lắp Sông Đà,Song Da Investment and Construction Joint Stock Company,SDD,,UPCOM,SDD,SDD,,upcom:3745,2022-05-05T06:56:56.262Z,2023-10-04T01:30:24.072Z,37393132224.0,16007334.0,,,
s,Công ty Cổ phần Tập đoàn Thủy sản Minh Phú,Minh Phu Seafood Joint Stock Company,MPC,,UPCOM,MPC,MPC,,upcom:76602,2022-05-05T06:56:56.314Z,2023-10-04T01:30:24.269Z,7826994122900.0,399887300.0,,,
s,Công ty Cổ phần Vật liệu Xây dựng và Chất đốt Đồng Nai,Dong Nai Building Material and Fuel Joint Stock Company,BMF,,UPCOM,BMF,BMF,,upcom:77140,2022-05-05T06:56:56.252Z,2023-10-04T01:30:24.787Z,175375240590.0,15848115.0,,,
s,Công ty Cổ phần Sông Đà 12,Song Da No 12 Joint Stock Company,S12,,UPCOM,S12,S12,,upcom:3624,2022-05-05T06:56:56.285Z,2023-10-04T01:30:25.175Z,7000000000.0,5000000.0,,,
s,Tổng Công ty Đức Giang - Công ty Cổ phần,Duc Giang Corporation,MGG,,UPCOM,MGG,MGG,,upcom:76629,2022-05-05T06:56:56.308Z,2023-10-04T01:30:25.195Z,253186365726.0,8999622.0,,,
s,Công ty Cổ phần Phục vụ Mai táng Hải Phòng,Haiphong Funeral Services Joint Stock Company,CPH,,UPCOM,CPH,CPH,,upcom:75622,2022-05-05T06:56:56.312Z,2023-10-04T01:30:25.288Z,1320000000.0,4400000.0,,,
s,Công ty Cổ phần Cầu 12,Bridge Joint Stock Company No.12,C12,,UPCOM,C12,C12,,upcom:75413,2022-05-05T06:56:56.316Z,2023-10-04T01:30:25.901Z,17460000000.0,4850000.0,,,
s,Công ty Cổ phần Công trình giao thông Hà Nội,Ha Noi Transport Project Joint Stock Company,GH3,,UPCOM,GH3,GH3,,upcom:80364,2022-05-05T06:56:56.311Z,2023-10-04T01:30:26.445Z,59794384000.0,11498920.0,,,
s,Công ty Cổ phần May Bình Minh,Binh Minh Garment Joint Stock Company,BMG,,UPCOM,BMG,BMG,,upcom:77999,2022-05-05T06:56:56.318Z,2023-10-04T01:30:26.585Z,103194000000.0,5292000.0,,,
s,Công ty Cổ phần Đầu tư và Dịch vụ hạ tầng Xăng dầu,Petroleum Logistic Service and Investment Joint Stock Company,PLA,,UPCOM,PLA,PLA,,upcom:76648,2022-05-05T06:56:56.318Z,2023-10-04T01:30:27.328Z,76940000000.0,10000000.0,,,
s,Công ty Cổ phần Masan MEATLife,Masan MEATLife Joint Stock Company,MML,,UPCOM,MML,MML,,upcom:78922,2022-05-05T06:56:56.328Z,2023-10-04T01:30:27.450Z,8848291761120.0,327132940.0,,,
s,Công ty Cổ phần Cà phê Thuận An,Thuan An Coffee Joint Stock Company,TAN,,UPCOM,TAN,TAN,,upcom:78400,2022-05-05T06:56:56.312Z,2023-10-04T01:30:27.891Z,64063493000.0,1613690.0,,,
s,Công ty Cổ phần Kim loại màu Thái Nguyên - Vimico,Vimico - Thai Nguyen Non Ferrous Metal Joint Stock Company ,TMG,,UPCOM,TMG,TMG,,upcom:75623,2022-05-05T06:56:56.332Z,2023-10-04T01:30:28.036Z,993600000000.0,18000000.0,,,
s,Công ty Cổ phần Công trình Giao thông Đồng Nai,DONA Transportation Construction Joint Stock Company,DGT,,UPCOM,DGT,DGT,,upcom:54485,2022-05-05T06:56:56.263Z,2023-10-04T01:30:28.165Z,514685000000.0,79000000.0,,,
s,Công ty Cổ phần Thủy điện Buôn Đôn,Buon Don Hydropower Joint Stock Company,BSA,,UPCOM,BSA,BSA,,upcom:77679,2022-05-05T06:56:56.254Z,2023-10-04T01:30:28.810Z,1196632452500.0,66850975.0,,,
s,Công ty Cổ phần Cấp nước Thanh Hóa,Thanh Hoa Water Supply Joint Stock Company,THN,,UPCOM,THN,THN,,upcom:76601,2022-05-05T06:56:56.264Z,2023-10-04T01:30:28.881Z,92387150800.0,32995411.0,,,
s,Tổng Công ty Dầu Việt Nam - Công ty Cổ phần,PetroVietnam Oil Corporation,OIL,,UPCOM,OIL,OIL,,upcom:77019,2022-05-05T06:56:56.330Z,2023-10-04T01:30:29.415Z,10579133555500.0,1034229500.0,,,
s,Công ty Cổ phần Điện tử Bình Hòa,Viettronics Binh Hoa Joint Stock Company,VBH,,UPCOM,VBH,VBH,,upcom:1782,2022-05-05T06:56:56.253Z,2023-10-04T01:30:29.556Z,55680000000.0,2900000.0,,,
b,,,VBA121033,,HNX,VBA121033,VBA121033,,hnx:81181,2022-07-14T01:15:00.560Z,2022-07-14T01:15:00.561Z,,,,,
s,Công ty Cổ phần Địa ốc Tân Bình,Tan Binh Real Estate Joint Stock Company,TBR,,UPCOM,TBR,TBR,,upcom:81221,2022-07-20T01:15:01.177Z,2023-10-04T01:30:30.763Z,56420000000.0,8060000.0,,,
b,,,TNG122017,,HNX,TNG122017,TNG122017,,hnx:81321,2022-08-19T01:15:00.536Z,2022-08-19T01:15:00.536Z,,,,,
s,Công ty Cổ phần Chiếu sáng công cộng Đà Nẵng,Da Nang Public Lighting Joint Stock Company,DLM,,UPCOM,DLM,DLM,,upcom:81523,2023-01-06T00:50:00.315Z,2023-10-04T01:30:31.321Z,18729750000.0,1657500.0,,,
s,Công ty Cổ phần Hoàng Hà,Hoang Ha Joint Stock Company,HHG,,UPCOM,HHG,HHG,,upcom:12292,2023-05-09T00:50:00.273Z,2023-10-04T01:30:31.465Z,74643301206.0,34896354.0,,,
s,Công ty Cổ phần VKC Holdings,VKC Holdings Joint Stock Company,VKC,,UPCOM,VKC,VKC,,upcom:14196,2023-05-09T00:50:00.273Z,2023-10-04T01:30:31.486Z,19279000000.0,19279000.0,,,
s,Công ty Cổ phần Vang Thăng Long,Thang Long Wine Joint Stock Company,VTL,,UPCOM,VTL,VTL,,upcom:7,2023-06-03T01:45:18.067Z,2023-10-04T01:30:31.737Z,143703772800.0,10119984.0,,,
s,Công ty Cổ phần Năng lượng và Bất động sản MCG,MCG Energy and Real Estate Joint Stock Company,MCG,,UPCOM,MCG,MCG,,upcom:81661,2023-06-03T01:45:18.067Z,2023-10-04T01:30:31.752Z,133716450000.0,52050000.0,,,
s,Công ty Cổ phần Licogi 16.6,Licogi 16.6 Joint Stock Company,LCS,,UPCOM,LCS,LCS,,upcom:11612,2023-06-03T01:45:18.068Z,2023-10-04T01:30:31.862Z,9120000000.0,7600000.0,,,
w,,,CHPG2307,,HOSE,CHPG2307,CHPG2307,Chung quyen.HPG.KIS.M.CA.,hose:4695,2023-06-14T00:50:00.234Z,2023-06-14T00:50:00.234Z,,,,,
w,,,CSTB2305,,HOSE,CSTB2305,CSTB2305,Chung quyen.STB.KIS.M.CA.,hose:4698,2023-06-14T00:50:00.235Z,2023-06-14T00:50:00.235Z,,,,,
w,,,CMBB2306,,HOSE,CMBB2306,CMBB2306,CHUNG QUYEN MBB/ACBS/CALL,hose:4713,2023-06-15T00:50:00.330Z,2023-06-15T00:50:00.330Z,,,,,
s,Tổng Công ty Cổ phần Phong Phú,Phong Phu Corporation,PPH,,UPCOM,PPH,PPH,,upcom:76404,2022-05-05T06:56:56.324Z,2023-10-04T01:30:23.079Z,1940995140654.0,74670891.0,,,
s,Công ty Cổ phần Kim Khí Hà Nội - VNSTEEL,VNSTEEL - Hanoi Steel Corporation,HMG,,UPCOM,HMG,HMG,,upcom:74981,2022-05-05T06:56:56.324Z,2023-10-04T01:30:23.796Z,119700000000.0,9000000.0,,,
s,Công ty Cổ phần Điện lực Gelex,GELEX Electricity Joint Stock Company,GEE,,UPCOM,GEE,GEE,,upcom:80881,2022-05-05T06:56:56.328Z,2023-10-04T01:30:23.910Z,7486500000000.0,300000000.0,,,
s,Công ty Cổ phần Nước giải khát Sanna Khánh Hòa,Sanna Khanh Hoa Beverage Joint Stock Company,SKN,,UPCOM,SKN,SKN,,upcom:77780,2022-05-05T06:56:56.322Z,2023-10-04T01:30:24.395Z,55000000000.0,5000000.0,,,
s,Công ty Cổ phần Rượu Hapro,Hapro Vodka Joint Stock Company,HAV,,UPCOM,HAV,HAV,,upcom:76723,2022-05-05T06:56:56.323Z,2023-10-04T01:30:24.416Z,9893580000.0,3297860.0,,,
s,Công ty Cổ phần Thủy Đặc Sản,Special Aquatic Products Joint Stock Company,SPV,,UPCOM,SPV,SPV,,upcom:75679,2022-05-05T06:56:56.325Z,2023-10-04T01:30:24.465Z,162000000000.0,10800000.0,,,
s,Công ty Cổ phần Khoáng Sản và Luyện Kim Cao Bằng,Cao Bang Mineral and Metallurgical Joint Stock Company,KCB,,UPCOM,KCB,KCB,,upcom:74020,2022-05-05T06:56:56.280Z,2023-10-04T01:30:25.816Z,59512000000.0,8000000.0,,,
s,Công ty Cổ phần Đầu tư Xây dựng Long An IDICO,IDICO-Long An Investment Construction Joint Stock Company,LAI,,UPCOM,LAI,LAI,,upcom:73601,2022-05-05T06:56:56.313Z,2023-10-04T01:30:25.886Z,359382150000.0,8550000.0,,,
s,Công ty Cổ phần Đầu tư PVR Hà Nội,Ha Noi PVR Investment Joint Stock Company,PVR,,UPCOM,PVR,PVR,,upcom:10952,2022-05-05T06:56:56.262Z,2023-10-04T01:30:26.204Z,67478726900.0,51906713.0,,,
s,Công ty Cổ phần Chăn nuôi - Mitraco,Mitraco Livestock Joint Stock Company,MLS,,UPCOM,MLS,MLS,,upcom:75459,2022-05-05T06:56:56.333Z,2023-10-04T01:30:26.757Z,53200000000.0,4000000.0,,,
s,Công ty Cổ phần Xi măng Sông Lam 2,Cement Joint Stock Company Song Lam 2,PX1,,UPCOM,PX1,PX1,,upcom:63535,2022-05-05T06:56:56.266Z,2023-10-04T01:30:27.005Z,200000000000.0,20000000.0,,,
s,Công ty Cổ phần EVN Quốc Tế,EVN International Joint Stock Company,EIC,,UPCOM,EIC,EIC,,upcom:75670,2022-05-05T06:56:56.328Z,2023-10-04T01:30:28.000Z,792593103450.0,36677145.0,,,
s,Công ty Cổ phần Cà phê Thắng Lợi,Thang Loi Coffee Joint Stock Company,CFV,,UPCOM,CFV,CFV,,upcom:78360,2022-05-05T06:56:56.274Z,2023-10-04T01:30:28.276Z,354200000000.0,12650000.0,,,
s,Công ty Cổ phần Tập đoàn HIPT,HIPT Group Joint Stock Company,HIG,,UPCOM,HIG,HIG,,upcom:54044,2022-05-05T06:56:56.275Z,2023-10-04T01:30:28.323Z,180472240000.0,22559030.0,,,
s,Công ty Cổ phần Thể thao Ngôi sao Geru,Geru Star Sport Joint Stock Company,GER,,UPCOM,GER,GER,,upcom:55364,2022-05-05T06:56:56.277Z,2023-10-04T01:30:28.362Z,18920000000.0,2200000.0,,,
s,Công ty Cổ phần VINACAP Kim Long,VINACAP Kim Long Joint Stock Company,VTE,,UPCOM,VTE,VTE,,upcom:77300,2022-05-05T06:56:56.277Z,2023-10-04T01:30:29.075Z,106080000000.0,15600000.0,,,
s,Công ty Cổ phần MERUFA,MERUFA Joint Stock Company,MRF,,UPCOM,MRF,MRF,,upcom:76761,2022-05-05T06:56:56.320Z,2023-10-04T01:30:29.246Z,150535764000.0,3671604.0,,,
s,Công ty Cổ phần VITALY,Vitaly Joint Stock Company,VTA,,UPCOM,VTA,VTA,,upcom:67456,2022-05-05T06:56:56.264Z,2023-10-04T01:30:29.635Z,36544000000.0,8000000.0,,,
b,,,TN1122016,,HNX,TN1122016,TN1122016,,hnx:81223,2022-07-20T01:15:01.111Z,2022-07-20T01:15:01.111Z,,,,,
b,,,CVT122009,,HNX,CVT122009,CVT122009,,hnx:81282,2022-08-18T09:38:15.434Z,2022-08-18T09:38:15.434Z,,,,,
b,,,BAF122029,,HNX,BAF122029,BAF122029,,hnx:81501,2022-12-30T00:50:00.209Z,2022-12-30T00:50:00.209Z,,,,,
w,,,CMWG2215,,HOSE,CMWG2215,CMWG2215,CHUNG QUYEN MWG-HSC-MET13,hose:4646,2023-01-05T00:50:00.247Z,2023-01-05T00:50:00.247Z,,,,,
b,,,BAB123006,,HNX,BAB123006,BAB123006,,hnx:81721,2023-06-03T01:45:17.131Z,2023-06-03T01:45:17.131Z,,,,,
w,,,CHPG2308,,HOSE,CHPG2308,CHPG2308,Chung quyen.HPG.KIS.M.CA.,hose:4696,2023-06-14T00:50:00.234Z,2023-06-14T00:50:00.234Z,,,,,
w,,,CMSN2301,,HOSE,CMSN2301,CMSN2301,Chung quyen.MSN.KIS.M.CA.,hose:4704,2023-06-14T00:50:00.235Z,2023-06-14T00:50:00.235Z,,,,,
w,,,CNVL2301,,HOSE,CNVL2301,CNVL2301,Chung quyen.NVL.KIS.M.CA.,hose:4709,2023-06-14T00:50:00.236Z,2023-06-14T00:50:00.236Z,,,,,
w,,,CSTB2306,,HOSE,CSTB2306,CSTB2306,CHUNG QUYEN STB/ACBS/CALL,hose:4716,2023-06-15T00:50:00.330Z,2023-06-15T00:50:00.330Z,,,,,
f,,,GB05F2403,,FU,GB05F2403,GB05F2403,,fu:1187,2023-06-16T00:50:00.374Z,2023-06-16T00:50:00.374Z,,,,,
s,Công ty cổ phần Petro Times,Petro Times Joint Stock Company,PPT,,HNX,PPT,PPT,,hnx:81102,2023-06-26T00:50:00.310Z,2023-10-04T01:30:31.909Z,190575000000.0,15750000.0,,,
s,Công ty Cổ phần Vinatex Đà Nẵng,Vinatex Da Nang Joint Stock Company,VDN,,UPCOM,VDN,VDN,,upcom:54645,2022-05-05T06:56:56.318Z,2023-10-04T01:30:23.721Z,41012563000.0,3130730.0,,,
s,Công ty Cổ phần Điện nước An Giang,An Giang Power and Water Supply Joint Stock Company,DNA,,UPCOM,DNA,DNA,,upcom:76639,2022-05-05T06:56:56.332Z,2023-10-04T01:30:23.958Z,1104059513200.0,56329567.0,,,
s,Công ty Cổ phần Bến bãi vận tải Sài Gòn,Sai Gon Transporation Parking Joint Stock Company,TPS,,UPCOM,TPS,TPS,,upcom:74000,2022-05-05T06:56:56.252Z,2023-10-04T01:30:24.021Z,82500000000.0,5000000.0,,,
s,Công ty Cổ phần Sản xuất và Cung ứng vật liệu xây dựng Kon Tum,Kon Tum Construction Materials Supply And Production Joint Stock Company,NXT,,UPCOM,NXT,NXT,,upcom:80621,2022-05-05T06:56:56.315Z,2023-10-04T01:30:24.287Z,90413400000.0,6600000.0,,,
s,Công ty Cổ phần Quảng cáo và Hội chợ Thương mại Vinexad,Vietnam National Trade Fair And Advertising Company,VNX,,UPCOM,VNX,VNX,,upcom:54344,2022-05-05T06:56:56.332Z,2023-10-04T01:30:24.644Z,33073596000.0,1224948.0,,,
s,Công ty Cổ phần Đầu tư và Phát triển Năng lượng Việt Nam,Vietnam Power Investment and Development Joint Stock Company,VPC,,UPCOM,VPC,VPC,,upcom:19156,2022-05-05T06:56:56.333Z,2023-10-04T01:30:24.693Z,12937500000.0,5625000.0,,,
