type,clientName,clientNameEn,code,description,exchange,full_name,name,securityName,stockNo,createdAt,updatedAt,marketCapPrev,sharesOutstanding,sort,symbol_ref,lastDateSyncIDS
s,Công ty Cổ phần Tập đoàn Điện Quang,Dien Quang Group Joint Stock Company,DQC,,HOSE,DQC,DQC,CTCP BONG DEN DIEN QUANG,hose:637,2022-04-07T03:00:04.686Z,2023-10-04T01:30:08.709Z,483644058300.0,27558066.0,,,
s,Công ty Cổ phần FECON,FECON Corporation,FCN,,HOSE,FCN,FCN,CTCP KT NM&CT NGAM FECON,hose:978,2022-04-07T03:00:04.682Z,2023-10-04T01:30:08.724Z,2282865572500.0,157439005.0,,,
s,Công ty Cổ phần DRH Holdings,DRH Holdings JSC,DRH,,HOSE,DRH,DRH,CTCP DT CAN NHA MO UOC,hose:651,2022-04-07T03:00:04.676Z,2023-10-04T01:30:08.774Z,630910116600.0,123707866.0,,,
s,Công ty Cổ phần Tập đoàn An Phát Holdings,An Phat Holdings Joint Stock Company,APH,,HOSE,APH,APH,CTCP TD AN PHAT HOLDING,hose:307,2022-04-07T03:00:04.684Z,2023-10-04T01:30:08.856Z,1873031178240.0,243884268.0,,,
s,Công ty Cổ phần Địa ốc First Real,First Real Joint Stock Company,FIR,,HOSE,FIR,FIR,CTCP DIA OC FIRST REAL,hose:53,2022-04-07T03:00:04.697Z,2023-10-04T01:30:09.134Z,1432669766300.0,64245281.0,,,
s,Công ty Cổ phần Kinh doanh và Phát triển Bình Dương,Binhduong Trade And Development Joint Stock Company,TDC,,HOSE,TDC,TDC,CTCP KD&PT BINH DUONG,hose:3496,2022-04-07T03:00:04.717Z,2023-10-04T01:30:09.210Z,950000000000.0,100000000.0,,,
s,Công ty Cổ phần Đầu tư Thương mại SMC,SMC Trading Investment Joint Stock Company,SMC,,HOSE,SMC,SMC,CTCP DAU TU THUONGMAI SMC,hose:2911,2022-04-07T03:00:04.696Z,2023-10-04T01:30:09.396Z,802314523300.0,73606837.0,,,
s,Công ty Cổ phần Transimex,Transimex Corporation,TMS,,HOSE,TMS,TMS,CTY CP KHO VAN GIAO NHAN,hose:3275,2022-04-07T03:00:04.705Z,2023-10-04T01:30:09.486Z,6975600349800.0,121738226.0,,,
s,Công ty Cổ phần Sản xuất và Công nghệ Nhựa Pha Lê,Pha Le Plastics Manufacturing and Technology Joint Stock Company,PLP,,HOSE,PLP,PLP,CTCP SX & CN NHUA PHA LE,hose:2577,2022-04-07T03:00:04.717Z,2023-10-04T01:30:09.992Z,314999311500.0,69999847.0,,,
s,Công ty Cổ phần Chứng khoán SSI,SSI Securities Corporation,SSI,,HOSE,SSI,SSI,CTCP CHUNG KHOAN SSI,hose:2920,2022-04-07T03:00:04.720Z,2023-10-04T01:30:10.065Z,45273987803800.0,1499138669.0,,,2023-10-04T01:30:33.378Z
s,Công ty Cổ phần Tập đoàn Thiên Long,Thien Long Group Corporation,TLG,,HOSE,TLG,TLG,CTCP TAP DOAN THIEN LONG,hose:3495,2022-04-07T03:00:04.712Z,2023-10-04T01:30:10.200Z,4130885454300.0,77794453.0,,,
s,Công ty Cổ phần Nhiên liệu Sài Gòn,Saigon Fuel Joint Stock Company,SFC,,HOSE,SFC,SFC,CTCP NHIEN LIEU SAI GON,hose:2905,2022-04-07T03:00:04.725Z,2023-10-04T01:30:10.267Z,198856296300.0,11234819.0,,,
s,Công ty Cổ phần Cao su Sao Vàng,Sao Vang Rubber Joint Stock Company,SRC,,HOSE,SRC,SRC,CTCP CAO SU SAO VANG,hose:2926,2022-04-07T03:00:04.691Z,2023-10-04T01:30:10.315Z,575299044000.0,28063368.0,,,
s,Công ty Cổ phần Tập đoàn Dabaco Việt Nam,DABACO Group,DBC,,HOSE,DBC,DBC,CTCP TD DABACO VIET NAM,hose:101,2022-04-07T03:00:04.691Z,2023-10-04T01:30:10.342Z,5154639596700.0,242001859.0,,,
s,Tổng Công ty Cổ phần Khoan và Dịch vụ khoan Dầu khí,PetroVietNam Driling & Well Services Corporation,PVD,,HOSE,PVD,PVD,CTCP KHOAN VA DV DAU KHI,hose:2548,2022-04-07T03:00:04.715Z,2023-10-04T01:30:11.507Z,13646854147300.0,555880006.0,,,
s,Công ty Cổ phần Điện lực Dầu khí Nhơn Trạch 2,PetroVietnam Power Nhon Trach 2 Joint Stock Company,NT2,,HOSE,NT2,NT2,CTCP DLDK NHON TRACH 2,hose:2198,2022-04-07T03:00:04.721Z,2023-10-04T01:30:12.227Z,6966599901800.0,287876029.0,,,
s,Công ty Cổ Phần Thủy Sản MeKong,Mekong Fisheries Joint Stock Company,AAM,,HOSE,AAM,AAM,CTCP THUY SAN MEKONG,hose:9,2022-04-07T03:00:04.690Z,2023-10-04T01:30:12.358Z,109737411000.0,10451182.0,,,
s,Công ty Cổ phần Tập Đoàn Hapaco,Hapaco Group Joint Stock Company,HAP,,HOSE,HAP,HAP,CTCP TAP DOAN HAPACO,hose:1291,2022-04-07T03:00:04.697Z,2023-10-04T01:30:12.375Z,524757088460.0,110942302.0,,,
s,Tổng Công ty Việt Thắng - CTCP,Viet Thang Corporation - JSC,TVT,,HOSE,TVT,TVT,CTCP TCT VIET THANG,hose:3511,2022-04-07T03:00:04.698Z,2023-10-04T01:30:12.394Z,339150000000.0,21000000.0,,,
e,Quỹ ETF IPAAM VN100,ETF IPAAM VN100 Fund,FUEIP100,,HOSE,FUEIP100,FUEIP100,QUY ETF IPAAM VN100,hose:4161,2022-04-07T03:00:04.708Z,2023-10-04T01:30:12.445Z,48906000000.0,5700000.0,,,
s,Công ty Cổ phần Vận tải Đa phương thức Duyên Hải,Duyen Hai Multi Modal Transport Joint Stock Company,TCO,,HOSE,TCO,TCO,CTCP VT DPT DUYEN HAI,hose:3502,2022-04-07T03:00:04.733Z,2023-10-04T01:30:12.971Z,233887500000.0,18711000.0,,,
s,Công ty Cổ phần Đầu tư Xây dựng và Phát triển Đô thị Thăng Long,Thang Long Urban Development and Construction Investment Joint Stock Company,TLD,,HOSE,TLD,TLD,CTCP DTXD&PTDT THANG LONG,hose:3512,2022-04-07T03:00:04.734Z,2023-10-04T01:30:12.989Z,331901481840.0,74752586.0,,,
s,Công ty Cổ phần Chứng khoán Thành phố Hồ Chí Minh,Ho Chi Minh City Securities Corporation,HCM,,HOSE,HCM,HCM,CTY CPCK TP HO CHI MINH,hose:1366,2022-04-07T03:00:04.734Z,2023-10-04T01:30:13.023Z,13259146521000.0,457211949.0,,,
s,Công ty Cổ phần Thép VICASA - VNSTEEL,VNSTEEL - VICASA Joint Stock Company,VCA,,HOSE,VCA,VCA,CTCP THEP VICASA-VNSTEEL,hose:701,2022-04-07T03:00:04.747Z,2023-10-04T01:30:13.153Z,136685898000.0,15187322.0,,,
s,Công ty Cổ phần Thế Giới Số,Digiworld Corporation,DGW,,HOSE,DGW,DGW,CTCP THE GIOI SO,hose:656,2022-04-07T03:00:04.736Z,2023-10-04T01:30:13.415Z,9005233298600.0,167072974.0,,,
s,Tổng Công ty Hàng không Việt Nam - CTCP,Vietnam Airlines Joint Stock Company,HVN,,HOSE,HVN,HVN,TCT HANG KHONG VIET NAM,hose:69,2022-04-07T03:00:04.743Z,2023-10-04T01:30:13.904Z,25244093583600.0,2214394174.0,,,
s,Công ty Cổ phần Tập đoàn Thành Nam,Thanh Nam Group Joint Stock Company,TNI,,HOSE,TNI,TNI,CTCP TAP DOAN THANH NAM,hose:3508,2022-04-07T03:00:04.736Z,2023-10-04T01:30:14.045Z,148575000000.0,52500000.0,,,
s,Công ty Cổ phần Tập đoàn Dầu khí An Pha,An Pha Petrol Joint Stock Company,ASP,,HOSE,ASP,ASP,CTCP DAU KHI AN PHA S.G,hose:7,2022-04-07T03:00:04.745Z,2023-10-04T01:30:14.425Z,216569343600.0,37339542.0,,,
s,Công ty Cổ phần Nông nghiệp BAF Việt Nam,BAF Vietnam Agriculture Joint Stock Company,BAF,,HOSE,BAF,BAF,CTCP NONG NGHIEP BAF VIET,hose:4356,2022-04-07T03:00:04.734Z,2023-10-04T01:30:14.745Z,3329664000000.0,143520000.0,,,
s,Công ty Cổ phần Thủy điện Sê San 4A,SeSan 4A HydroElectric Joint Stock Company,S4A,,HOSE,S4A,S4A,CTCP THUY DIEN SE SAN 4A,hose:2944,2022-04-07T03:00:04.735Z,2023-10-04T01:30:14.758Z,1483330000000.0,42200000.0,,,
s,Công ty Cổ phần Tàu Cao tốc Superdong - Kiên Giang,Superdong - Kien Giang Fast Ferry Joint Stock Company,SKG,,HOSE,SKG,SKG,CTCP TCT SUPERDONG-KG,hose:2940,2022-04-07T03:00:04.740Z,2023-10-04T01:30:15.307Z,946809438250.0,63331735.0,,,
s,Công ty Cổ phần Phát triển Nhà Thủ Đức,Thu Duc Housing Development Corporation,TDH,,HOSE,TDH,TDH,CTCP PT NHA THU DUC,hose:3476,2022-05-04T01:15:00.638Z,2023-10-04T01:30:15.631Z,555378141310.0,112652767.0,,,
s,Công ty Cổ phần Rau quả Thực phẩm An Giang,An Giang Fruit-Vegetables & Foodstuff Joint Stock Company,ANT,,UPCOM,ANT,ANT,,upcom:75408,2022-05-05T06:56:56.186Z,2023-10-04T01:30:16.155Z,143999880000.0,14399988.0,,,
s,Công ty Cổ phần Đầu tư Phát triển Xây dựng số 1,Development Investment Construction Number 1 Joint Stock Company,DC1,,UPCOM,DC1,DC1,,upcom:74839,2022-05-05T06:56:56.191Z,2023-10-04T01:30:16.176Z,34084318079.0,4504337.0,,,
s,Công ty Cổ phần Sông Đà 25,Song Da No. 25 Joint Stock Company,SDJ,,UPCOM,SDJ,SDJ,,upcom:72839,2022-05-05T06:56:56.199Z,2023-10-04T01:30:16.694Z,13465470000.0,4343700.0,,,
s,Công ty Cổ phần Lương thực Thực phẩm Colusa - Miliket,Colusa - Miliket Foodstuff Joint Stock Company,CMN,,UPCOM,CMN,CMN,,upcom:76280,2022-05-05T06:56:56.224Z,2023-10-04T01:30:17.200Z,292800000000.0,4800000.0,,,
s,Công ty Cổ phần Xuất nhập khẩu Thủy sản Miền Trung,Danang Seaproducts Import - Export Corporation,SPD,,UPCOM,SPD,SPD,,upcom:54844,2022-05-05T06:56:56.231Z,2023-10-04T01:30:17.562Z,138000000000.0,12000000.0,,,
s,Công ty Cổ phần Tổng Công ty Thương mại Quảng Trị,Quang Tri General Trading Joint Stock Company,SEP,,UPCOM,SEP,SEP,,upcom:75587,2022-05-05T06:56:56.233Z,2023-10-04T01:30:17.575Z,179760000000.0,8400000.0,,,
s,Công ty Cổ phần Tổng Công ty Công trình Đường sắt,Railway Construction Corporation Joint Stock Company,RCC,,UPCOM,RCC,RCC,,upcom:75361,2022-05-05T06:56:56.205Z,2023-10-04T01:30:17.767Z,480971235000.0,32064749.0,,,
s,Công ty Cổ phần Lệ Ninh,Le Ninh Joint Stock Company,LNC,,UPCOM,LNC,LNC,,upcom:78519,2022-05-05T06:56:56.239Z,2023-10-04T01:30:18.386Z,82300670000.0,8230067.0,,,
s,Công ty Cổ phần Đầu tư Xây dựng và Phát triển Hạ tầng Viễn Thông,Construction Investment and Telecommunications Infrastructure Development Joint Stock Company,QCC,,UPCOM,QCC,QCC,,upcom:12512,2022-05-05T06:56:56.205Z,2023-10-04T01:30:18.640Z,15025610000.0,1329700.0,,,
s,Công ty cổ phần Vật tư Bưu điện,Posts and Telecommunications Material Supply Joint Stock Company,PMJ,,UPCOM,PMJ,PMJ,,upcom:74759,2022-05-05T06:56:56.268Z,2023-10-04T01:30:19.190Z,35640000000.0,1800000.0,,,
s,Công ty Cổ phần Kho vận Petec,Petec Logistics Joint Stock Company,PLO,,UPCOM,PLO,PLO,,upcom:79241,2022-05-05T06:56:56.273Z,2023-10-04T01:30:19.207Z,21577650000.0,7192550.0,,,
s,Công ty Cổ phần Dược phẩm Trung ương 2,Central Phamarceutical Joint Stock Company No 2,DP2,,UPCOM,DP2,DP2,,upcom:76061,2022-05-05T06:56:56.273Z,2023-10-04T01:30:19.222Z,100000000000.0,20000000.0,,,
s,Công ty Cổ phần Đầu tư Xây dựng và Công nghệ Tiến Trung,Tien Trung Investment Construction and Technology Joint Stock Company,TTZ,C.nghệ Tiến Trung,HNX,TTZ,TTZ,,hnx:20036,2022-02-18T12:28:40.974Z,2023-10-04T01:30:02.702Z,13626799200.0,7570444.0,,,
s,Công ty Cổ phần Bia Hà Nội - Thanh Hóa,Ha Noi - Thanh Hoa Beer Joint Stock Company,THB,Bia Thanh Hóa,HNX,THB,THB,,hnx:5404,2022-02-18T12:28:40.979Z,2023-10-04T01:30:03.068Z,100536216000.0,11424570.0,,,
s,Công ty Cổ phần Thương mại và Dịch vụ Tiến Thành,Tien Thanh Service and Trading Joint Stock Company,TTH,DV Tiến Thành,HNX,TTH,TTH,,hnx:75179,2022-02-18T12:28:40.979Z,2023-10-04T01:30:03.123Z,156974353200.0,37374846.0,,,
s,Công ty Cổ phần Dây cáp điện Việt Thái,Viet Thai Electric Cable Corporation,VTH,Cáp Điện Việt Thái,HNX,VTH,VTH,,hnx:72919,2022-02-18T12:28:40.987Z,2023-10-04T01:30:03.571Z,62409913100.0,7899989.0,,,
s,Công ty Cổ phần Lâm Nông sản Thực phẩm Yên Bái,Yen Bai Joint Stock Forest Agricultural Products And Foodstuffs Company,CAP,Lâm Nông Sản Y.Bái,HNX,CAP,CAP,,hnx:3524,2022-02-18T12:28:40.997Z,2023-10-04T01:30:03.879Z,792170096000.0,10052920.0,,,
s,Công ty Cổ phần Phụ Gia Nhựa,Plastic Additives Joint Stock Company,PGN,CTCP Phụ Gia Nhựa,HNX,PGN,PGN,,hnx:78521,2022-02-18T12:28:41.001Z,2023-10-04T01:30:04.076Z,69297708000.0,8450940.0,,,
i,,,VNCONS,,HOSE,VNCONS,VNCONS,,,2022-02-18T12:28:41.004Z,2022-02-18T12:28:41.004Z,,,,,
s,Công ty Cổ phần Cấp nước Gia Định,Gia Dinh Wasuco Joint Stock Company,GDW,Cấp nc Gia Định,HNX,GDW,GDW,,hnx:54904,2022-02-18T12:28:41.019Z,2023-10-04T01:30:04.283Z,294500000000.0,9500000.0,,,
s,Công ty Cổ phần Thuận Đức,Thuan Duc Joint Stock Company,TDP,Thuận Đức,HOSE,TDP,TDP,CONG TY CO PHAN THUAN DUC,hose:367,2022-02-18T12:28:41.028Z,2023-10-04T01:30:04.361Z,2481094570050.0,75527993.0,,,
s,Công ty Cổ phần Nhựa Đà Nẵng,Da Nang Plastic Joint Stock Company,DPC,,HNX,DPC,DPC,,hnx:6484,2022-02-18T12:28:41.144Z,2023-10-04T01:30:05.100Z,25952448000.0,2237280.0,,,
s,Công ty Cổ phần Chứng khoán Châu Á - Thái Bình Dương,Asia - Pacific Securities Joint Stock Company,APS,,HNX,APS,APS,,hnx:9064,2022-02-18T12:28:41.145Z,2023-10-04T01:30:05.649Z,522900000000.0,83000000.0,,,
s,Công ty Cổ phần Gạch ngói Nhị Hiệp,Nhi Hiep Brick-Tile Joint Stock Company,NHC,,HNX,NHC,NHC,,hnx:6564,2022-02-18T12:28:41.148Z,2023-10-04T01:30:05.873Z,112232899800.0,3041542.0,,,
s,Công ty Cổ phần Địa ốc 11,Real Estate 11 Joint Stock Company,D11,,HNX,D11,D11,,hnx:14896,2022-02-18T12:28:41.149Z,2023-10-04T01:30:06.015Z,104201559600.0,7338138.0,,,
s,Công ty Cổ phần Sách và thiết bị giáo dục Miền Nam,South Books and Educational Equipment Joint Stock Company,SMN,,HNX,SMN,SMN,,hnx:73481,2022-02-18T12:28:41.149Z,2023-10-04T01:30:06.082Z,58910420000.0,4396300.0,,,
s,Công ty Cổ phần Mĩ thuật và Truyền thông,Art Design and Communication Joint Stock Company,ADC,,HNX,ADC,ADC,,hnx:14696,2022-02-18T12:28:41.149Z,2023-10-04T01:30:06.132Z,68022705600.0,3977936.0,,,
s,Công ty Cổ phần Đường Kon Tum,Kon Tum Sugar Joint Stock Company,KTS,,HNX,KTS,KTS,,hnx:14856,2022-02-18T12:28:41.151Z,2023-10-04T01:30:06.489Z,171873000000.0,5070000.0,,,
s,Công ty cổ phần Alphanam E&C,Alphanam E&C Joint Stock Company,AME,,HNX,AME,AME,,hnx:9464,2022-02-18T12:28:41.151Z,2023-10-04T01:30:06.559Z,541160000000.0,65200000.0,,,
s,Công ty Cổ phần Dịch vụ Kỹ thuật Điện lực Dầu khí Việt Nam,PetroVietnam Power Services Joint Stock Company,PPS,,HNX,PPS,PPS,,hnx:14916,2022-02-18T12:28:41.152Z,2023-10-04T01:30:06.834Z,165000000000.0,15000000.0,,,
s,Công ty Cổ phần Cơ điện Miền Trung,Central Area Electrical Mechanical Joint Stock Company,CJC,,HNX,CJC,CJC,,hnx:1161,2022-02-18T12:28:41.152Z,2023-10-04T01:30:06.913Z,206400000000.0,8000000.0,,,
i,,,VNMID,,HOSE,VNMID,VNMID,,,2022-03-21T01:15:00.076Z,2022-03-21T01:15:00.076Z,,,,,
s,Công ty Cổ phần Bán lẻ Kỹ thuật số FPT,FPT Digital Retail Joint Stock Company,FRT,,HOSE,FRT,FRT,CTCP BAN LE KTS FPT,hose:26,2022-04-07T03:00:04.681Z,2023-10-04T01:30:07.916Z,12125572621000.0,136242389.0,,,
s,Công ty Cổ phần Dược phẩm Trung ương VIDIPHA,VIDIPHA Central Pharmaceutical Joint Stock Company,VDP,,HOSE,VDP,VDP,CTCP DUOC PHAM TU VIDIPHA,hose:3851,2022-04-07T03:00:04.682Z,2023-10-04T01:30:08.090Z,629513209600.0,16831904.0,,,
s,Công ty Cổ phần Đầu tư và Phát triển Y tế Việt Nhật,Japan Vietnam Medical Investment and Development Joint Stock Company,JVC,,HOSE,JVC,JVC,CTCP TB Y TE VIET NHAT,hose:1604,2022-04-07T03:00:04.679Z,2023-10-04T01:30:08.260Z,387000588240.0,112500171.0,,,
s,Tổng Công ty Phân bón và Hóa chất Dầu khí - Công ty Cổ phần,Petrovietnam Fertilizer and Chemicals Corporation,DPM,,HOSE,DPM,DPM,CTCP PHAN DAM&HOA CHAT DK,hose:634,2022-04-07T03:00:04.679Z,2023-10-04T01:30:08.274Z,14870701880000.0,391334260.0,,,
s,Công ty Cổ phần Đầu tư Nam Long,Nam Long Investment Corporation,NLG,,HOSE,NLG,NLG,CTCP DAU TU NAM LONG,hose:2196,2022-04-07T03:00:04.677Z,2023-10-04T01:30:08.605Z,12559425810000.0,384080300.0,,,
s,Tổng Công ty Cổ phần Bảo Minh,BaoMinh Insurance Corporation,BMI,,HOSE,BMI,BMI,TCT CP BAO MINH,hose:206,2022-04-07T03:00:04.679Z,2023-10-04T01:30:08.842Z,2850223610000.0,109623985.0,,,
s,Công ty Cổ phần Bệnh viện Quốc tế Thái Nguyên,Thai Nguyen International Hospital Joint Stock Company,TNH,,HOSE,TNH,TNH,CTCP BVQT THAI NGUYEN,hose:612,2022-04-07T03:00:04.696Z,2023-10-04T01:30:09.113Z,2185941108000.0,95874610.0,,,
s,Công ty Cổ phần Thương mại Xuất nhập khẩu Thiên Nam,Thien Nam Trading Import-Export Joint Stock Company,TNA,,HOSE,TNA,TNA,CTCP TM XNK THIEN NAM,hose:3362,2022-04-07T03:00:04.720Z,2023-10-04T01:30:09.727Z,295387860000.0,49231310.0,,,
s,Công ty Cổ phần Tập đoàn Đại Dương,Ocean Group Joint Stock Company,OGC,,HOSE,OGC,OGC,CTCP TAP DOAN DAI DUONG,hose:2340,2022-04-07T03:00:04.743Z,2023-10-04T01:30:12.708Z,1751999994160.0,299999999.0,,,
s,Tổng Công ty Cổ phần Xây dựng điện Việt Nam,Vietnam Electricity Construction Joint Stock Corporation,VNE,,HOSE,VNE,VNE,CT CP XD DIEN VIET NAM,hose:3812,2022-04-07T03:00:04.733Z,2023-10-04T01:30:12.958Z,921757871250.0,81934033.0,,,
s,Ngân hàng Thương mại Cổ phần Quân đội,Military Commercial Joint Stock Bank,MBB,,HOSE,MBB,MBB,NGAN HANG TMCP QUAN DOI,hose:2027,2022-04-07T03:00:04.734Z,2023-10-04T01:30:13.854Z,94114217138600.0,5214084052.0,,,
s,Công ty Cổ phần Xây lắp Thừa Thiên Huế,Thua Thien Hue Construction Joint Stock Company,HUB,,HOSE,HUB,HUB,CTCP XAY LAP TTHUE,hose:68,2022-04-07T03:00:04.744Z,2023-10-04T01:30:14.625Z,454962960100.0,26298437.0,,,
s,Công ty Cổ phần Tập đoàn Tư vấn Đầu tư Xây dựng Kiên Giang,Kien Giang Construction Investment Consultancy Corporation,CKG,,HOSE,CKG,CKG,CTCP TD TVDTXD KIEN GIANG,hose:236,2022-04-07T03:00:04.735Z,2023-10-04T01:30:15.258Z,2238594983500.0,95259361.0,,,
s,Tập đoàn Xăng dầu Việt Nam,Vietnam National Petroleum Group,PLX,,HOSE,PLX,PLX,TAP DOAN XANG DAU VN,hose:2576,2022-04-07T03:00:04.746Z,2023-10-04T01:30:15.390Z,45741320460000.0,1270592235.0,,,
s,Công ty Cổ phần Nhựa Việt Nam,Vietnam Plastic Corporation,VNP,,UPCOM,VNP,VNP,,upcom:73639,2022-05-05T06:56:56.186Z,2023-10-04T01:30:15.726Z,245542602494.0,19428913.0,,,
s,Công ty Cổ phần Thương mại và Sản xuất Lập Phương Thành,Lap Phuong Thanh Production And Trading Joint Stock Company,LPT,,UPCOM,LPT,LPT,,upcom:79961,2022-05-05T06:56:56.197Z,2023-10-04T01:30:16.254Z,88476000000.0,12000000.0,,,
s,Tổng Công ty Cơ khí Xây dựng - CTCP,Construction Machinery Corporation - JSC,TCK,,UPCOM,TCK,TCK,,upcom:76625,2022-05-05T06:56:56.190Z,2023-10-04T01:30:16.343Z,93015000000.0,23850000.0,,,
s,Công ty Cổ phần Đầu tư và Thương mại DIC,DIC Investment and Trading Joint Stock Company,DIC,,UPCOM,DIC,DIC,,upcom:79521,2022-05-05T06:56:56.189Z,2023-10-04T01:30:16.534Z,41735296000.0,26084560.0,,,
s,Công ty Cổ phần Xà phòng Hà Nội,Hanoi Soap Joint Stock Company,XPH,,UPCOM,XPH,XPH,,upcom:73019,2022-05-05T06:56:56.204Z,2023-10-04T01:30:16.751Z,70051365000.0,12972475.0,,,
s,Công ty Cổ phần Phát triển điện Trà Vinh,Tra Vinh Electric Development Joint Stock Corporation,DTV,,UPCOM,DTV,DTV,,upcom:54787,2022-05-05T06:56:56.234Z,2023-10-04T01:30:16.815Z,184240000000.0,5264000.0,,,
s,Công ty Cổ phần Masan High-Tech Materials,Masan High-Tech Materials Corporation,MSR,,UPCOM,MSR,MSR,,upcom:73719,2022-05-05T06:56:56.225Z,2023-10-04T01:30:17.467Z,18949439440800.0,1099155420.0,,,
s,Công ty Cổ phần Vận tải và Tiếp vận Phương Đông Việt,Phuong Dong Viet Shipping and Logistics Corporation,PDV,,UPCOM,PDV,PDV,,upcom:75940,2022-05-05T06:56:56.245Z,2023-10-04T01:30:17.730Z,470125868541.0,43087331.0,,,
s,Công ty Cổ phần Damac GLS,Damac GLS Joint Stock Company,KSH,,UPCOM,KSH,KSH,,upcom:78723,2022-05-05T06:56:56.219Z,2023-10-04T01:30:18.141Z,40256772500.0,57509675.0,,,
s,Công ty Cổ phần Nước giải khát Sanest Khánh Hòa,Khanh Hoa Sanest Soft Drink Joint Stock Company,SKH,,UPCOM,SKH,SKH,,upcom:76623,2022-05-05T06:56:56.219Z,2023-10-04T01:30:18.155Z,847044000000.0,33000000.0,,,
s,Công ty Cổ phần Tổng Công ty Tín Nghĩa,Tin Nghia Corporation,TID,,UPCOM,TID,TID,,upcom:77899,2022-05-05T06:56:56.227Z,2023-10-04T01:30:18.242Z,4502600000000.0,200000000.0,,,
s,Công ty Cổ phần Tập đoàn Đua Fat,Dua Fat Group Joint Stock Company,DFF,,UPCOM,DFF,DFF,,upcom:80322,2022-05-05T06:56:56.211Z,2023-10-04T01:30:18.695Z,792000000000.0,80000000.0,,,
s,Công ty Cổ phần Mía đường Cao Bằng,Cao Bang Sugar Joint Stock Company,CBS,,UPCOM,CBS,CBS,,upcom:76162,2022-05-05T06:56:56.232Z,2023-10-04T01:30:18.728Z,179029186308.0,5291868.0,,,
s,Công ty Cổ phần Xây dựng Công trình ngầm,Underground Works Construction Joint Stock Company - VINAVICO,CTN,,UPCOM,CTN,CTN,,upcom:1401,2022-05-05T06:56:56.265Z,2023-10-04T01:30:19.134Z,2922507000.0,4870845.0,,,
s,Công ty Cổ phần Nước sạch Thái Nguyên,Thai Nguyen Water Joint Stock Company,TNW,,UPCOM,TNW,TNW,,upcom:76025,2022-05-05T06:56:56.307Z,2023-10-04T01:30:19.405Z,160000000000.0,16000000.0,,,
s,Tổng Công ty Cổ phần Sông Hồng,SongHong Joint Stock Corporation,SHG,,UPCOM,SHG,SHG,,upcom:73299,2022-05-05T06:56:56.325Z,2023-10-04T01:30:19.558Z,51300000000.0,27000000.0,,,
s,Công ty Cổ phần Đầu tư và Phát triển Sao Mai Việt,Sao Mai Viet Investment and Development Joint Stock Company,UNI,CTCP Viễn Liên,HNX,UNI,UNI,,hnx:6405,2022-02-18T12:28:40.975Z,2023-10-04T01:30:02.757Z,140558688000.0,15617632.0,,,
s,Công ty Cổ phần Thủy sản Bạc Liêu,Bac Lieu Fisheries Joint Stock Company,BLF,Thủy sản Bạc Liêu,HNX,BLF,BLF,,hnx:4576,2022-02-18T12:28:40.991Z,2023-10-04T01:30:03.701Z,36799996800.0,11499999.0,,,
s,Công ty Cổ phần Than Vàng Danh - Vinacomin,Vang Danh Coal Joint Stock Company,TVD,Than Vàng Danh,HNX,TVD,TVD,,hnx:14776,2022-02-18T12:28:40.975Z,2023-10-04T01:30:02.737Z,593509804800.0,44962864.0,,,
s,Công ty Cổ phần Tập đoàn C.E.O,CEO Group Joint Stock Company,CEO,Tập đoàn C.E.O,HNX,CEO,CEO,,hnx:72819,2022-02-18T12:28:40.997Z,2023-10-04T01:30:03.913Z,10036259415000.0,514679970.0,,,
i,,,HNXUPCOMINDEX,,UPCOM,UPCOM,HNXUPCOMINDEX,,,2022-02-18T12:28:41.004Z,2022-02-18T12:28:41.004Z,,,5.0,,
s,Công ty Cổ phần Bibica,Bibica Corporation,BBC,,HOSE,BBC,BBC,CTCP BIBICA,hose:190,2022-02-18T12:28:41.126Z,2023-10-04T01:30:04.645Z,1031397785000.0,18752687.0,,,
s,Công ty Cổ phần Đầu tư và Phát triển Bất động sản HUDLAND,HUDLAND Real Estate Investment and Development Joint,HLD,,HNX,HLD,HLD,,hnx:20916,2022-02-18T12:28:41.144Z,2023-10-04T01:30:05.324Z,540000000000.0,20000000.0,,,
s,Công ty Cổ phần Minh Khang Capital Trading Public,Minh Khang Capital Trading Public Joint Stock Company,CTP,,HNX,CTP,CTP,,hnx:74879,2022-02-18T12:28:41.144Z,2023-10-04T01:30:05.380Z,58079961600.0,12099992.0,,,
s,Công ty Cổ phần Tư vấn Xây dựng Điện 4,Power Engineering Consulting Joint Stock Company 4,TV4,,HNX,TV4,TV4,,hnx:4284,2022-02-18T12:28:41.144Z,2023-10-04T01:30:05.448Z,267050155500.0,19781493.0,,,
s,Công ty Cổ phần Chế tạo Bơm Hải Dương,Hai Duong Pump Manufacturing Joint Stock Company,CTB,,HNX,CTB,CTB,,hnx:702,2022-02-18T12:28:41.145Z,2023-10-04T01:30:05.694Z,300960000000.0,13680000.0,,,
s,Công ty Cổ phần Đầu tư Châu Á - Thái Bình Dương,Asia - Pacific Investment Joint Stock Company,API,,HNX,API,API,,hnx:13273,2022-02-18T12:28:41.148Z,2023-10-04T01:30:05.886Z,479278663200.0,84083976.0,,,
s,Công ty Cổ phần Kỹ thuật điện Toàn Cầu,Global Electrical Technology Corporation,GLT,,HNX,GLT,GLT,,hnx:7804,2022-02-18T12:28:41.150Z,2023-10-04T01:30:06.291Z,229098079000.0,9350942.0,,,
s,Công ty Cổ phần Đầu tư và Xây lắp Constrexim số 8,Constrexim No. 8 Investment and Construction Joint Stock Company,CX8,,HNX,CX8,CX8,,hnx:8644,2022-02-18T12:28:41.153Z,2023-10-04T01:30:07.105Z,14575611600.0,2208426.0,,,
s,Công ty Cổ phần Giao nhận Vận tải Ngoại Thương,Foreign Trade Forwarding and Transportation Joint Stock Company,VNT,,HNX,VNT,VNT,,hnx:7024,2022-02-18T12:28:41.154Z,2023-10-04T01:30:07.258Z,783936968700.0,16644097.0,,,
b,,,MSN120009,,HNX,MSN120009,MSN120009,,hnx:80683,2022-02-18T12:31:08.574Z,2022-04-20T10:50:23.820Z,,,,,
b,,,MSN120008,,HNX,MSN120008,MSN120008,,hnx:80684,2022-02-18T12:31:08.575Z,2022-04-20T10:50:24.143Z,,,,,
b,,,GEG121022,,HNX,GEG121022,GEG121022,,hnx:80722,2022-02-18T12:31:08.575Z,2022-04-20T10:50:24.732Z,,,,,
i,,,VNSML,,HOSE,VNSML,VNSML,,,2022-03-21T01:15:00.076Z,2022-03-21T01:15:00.076Z,,,,,
i,,,VNXALL,,HOSE,VNXALL,VNXALL,,,2022-03-21T01:15:00.075Z,2022-03-21T01:15:00.075Z,,,,,
s,Công ty Cổ phần Dược phẩm Cửu Long,Cuu Long Pharmaceutical Joint Stock Corporation,DCL,,HOSE,DCL,DCL,CTY CP DUOC PHAM CUU LONG,hose:640,2022-04-07T03:00:04.677Z,2023-10-04T01:30:08.904Z,1606902660000.0,73041030.0,,,
s,Công ty Cổ phần Thép Pomina,Pomina Steel Corporation,POM,,HOSE,POM,POM,CTCP THEP POMINA,hose:2562,2022-04-07T03:00:04.683Z,2023-10-04T01:30:08.936Z,1559843857600.0,278543546.0,,,
s,Công ty Cổ phần Victory Capital,Victory Capital Joint Stock Company,PTL,,HOSE,PTL,PTL,CTCP DT HT & DT DAU KHI,hose:2568,2022-04-07T03:00:04.717Z,2023-10-04T01:30:09.598Z,525962225600.0,98865080.0,,,
s,Tổng Công ty Điện lực Dầu khí Việt Nam - CTCP,PetroVietnam Power Corporation,POW,,HOSE,POW,POW,TCT DIEN LUC DAU KHI VN,hose:66,2022-04-07T03:00:04.710Z,2023-10-04T01:30:10.377Z,26228961920000.0,2341871600.0,,,
s,Công ty Cổ phần Đầu tư Phát triển Đô thị và Khu công nghiệp Sông Đà,Song Da Urban & Industrial Zone Investment and Development Joint Stock Company,SJS,,HOSE,SJS,SJS,CTCP DTPT DT&KCN SONG DA,hose:2907,2022-04-07T03:00:04.703Z,2023-10-04T01:30:10.547Z,7038864264000.0,113897480.0,,,
s,Công ty Cổ phần Đầu tư Hải Phát,Hai Phat Investment Joint Stock Company,HPX,,HOSE,HPX,HPX,CTCP DAU TU HAI PHAT,hose:41,2022-04-07T03:00:04.703Z,2023-10-04T01:30:12.023Z,1660760452260.0,304168581.0,,,
s,Công ty Cổ phần ICD Tân Cảng - Long Bình,ICD Tan Cang - Long Binh Joint Stock Company,ILB,,HOSE,ILB,ILB,CTCP ICD TAN CANG - LB,hose:70,2022-04-07T03:00:04.699Z,2023-10-04T01:30:12.410Z,738742686750.0,24502245.0,,,
s,Công ty Cổ phần Tập đoàn Khải Hoàn Land,Khai Hoan Land Group Joint Stock Company,KHG,,HOSE,KHG,KHG,CTCP BAT DONG SAN KHAI HO,hose:3984,2022-04-07T03:00:04.722Z,2023-10-04T01:30:12.516Z,2642679005400.0,449435205.0,,,
s,Công ty Cổ phần Đầu tư và Sản xuất Petro Miền Trung,Petro Center Corporation,PMG,,HOSE,PMG,PMG,CTCP DTSX PETRO MIENTRUNG,hose:2579,2022-04-07T03:00:04.741Z,2023-10-04T01:30:12.679Z,448998533820.0,46336278.0,,,
